{
  "$schema": "./manifold.meta.schema.json",
  "$id": "https://nxr.dev/schema/manifold.schema.json",
  "title": "NXR Manifold",
  "version": "0.1.0",

  "attributes": {
    "description": "Surface-mesh manifold object — the canonical NXR contract for a triangulated 2-manifold embedded in R^3. Design-time contract by which downstream NXR components (nxr-viewer, future nxr-graph, nxr-recording) are designed against nxr-compute. Not loaded at runtime.",
    "schema_version": "0.1.0",
    "fingerprint": "SHA-256 hex of canonicalized vertex+face bytes (computed by consumer)",
    "nxr_compute_version": "tracks the nxr-compute build that produced any concrete instance",
    "binding_storage_rule": "row-major flatten for [V,3]/[F,3]/[N,3]; vMajor (row-major) for [V,K] eigenvectors; complex_interleaved for complex types (re/im pairs adjacent). MEX is exempt from the JS flatten rule (uses MATLAB's native column-major storage).",
    "references": [
      "include/nxr/compute.h",
      "docs/architecture.md",
      "docs/superpowers/specs/2026-05-09-manifold-api-schema-design.md"
    ]
  },

  "core": {
    "attributes": {
      "description": "Required inputs. Everything else in the schema is derivable from these two buffers."
    },
    "vertices": {
      "attributes": {
        "description": "World-space vertex positions, row-major xyz triples.",
        "shape": "[V, 3]",
        "dtype": "float64",
        "storage": "row_major",
        "memory_bytes": "8 * V * 3",
        "depends_on": [],
        "implemented_by": {
          "cpp":        "nxr::compute::ComputeContext(vertices, nV, faces, nF) — first arg",
          "node_addon": "createContext(vertices, faces) — first arg",
          "wasm":       "createContext(vertices, faces) — first arg",
          "mex":        "nxr_compute('createContext', vertices, faces) — second arg"
        },
        "complexity": "O(1)",
        "units": "world units"
      }
    },
    "faces": {
      "attributes": {
        "description": "Triangle vertex-index triples (0-based at the nxr-compute boundary; MEX shell converts MATLAB 1-based on entry).",
        "shape": "[F, 3]",
        "dtype": "int32",
        "storage": "row_major",
        "memory_bytes": "4 * F * 3",
        "depends_on": [],
        "implemented_by": {
          "cpp":        "nxr::compute::ComputeContext(vertices, nV, faces, nF) — third arg",
          "node_addon": "createContext(vertices, faces) — second arg",
          "wasm":       "createContext(vertices, faces) — second arg",
          "mex":        "nxr_compute('createContext', vertices, faces) — third arg"
        },
        "complexity": "O(1)",
        "errors": ["NonManifold", "InvalidInput"]
      }
    }
  },

  "embedding": {
    "attributes": {
      "description": "World placement of the manifold (three.js Object3D analogue). Not strictly an nxr-compute concern; downstream consumers (nxr-viewer) compute and store this. Listed in the schema so consumers have a canonical place for it."
    },
    "bounding_box": {
      "attributes": {
        "description": "Axis-aligned bounding box in local coordinates: { min: [3], max: [3] }.",
        "shape": "{min[3], max[3]}",
        "dtype": "float64",
        "storage": "struct",
        "memory_bytes": "8 * 6",
        "depends_on": ["core/vertices"],
        "formula": "min_c = min_v vertices[v, c]; max_c = max_v vertices[v, c]",
        "complexity": "O(V)",
        "units": "world units"
      }
    },
    "transform": {
      "attributes": {
        "description": "Affine local-to-world transform (4×4). Default identity. Consumers (nxr-viewer) set this from scene-graph state; nxr-compute does not compute or modify it. Storage matches three.js Matrix4 (column-major in WebGL convention).",
        "shape": "[4, 4]",
        "dtype": "float64",
        "storage": "col_major",
        "memory_bytes": "8 * 16",
        "depends_on": [],
        "formula": "I_4 by default",
        "complexity": "O(1)"
      }
    }
  },

  "topology": {
    "attributes": {
      "description": "Halfedge structure and connectivity counts. Independent of the embedding — depends on faces only.",
      "n_edges": "derived from halfedge structure",
      "n_halfedges": "2*E for closed manifold; less for meshes with boundary",
      "euler_characteristic": "V - E + F",
      "n_boundary_loops": "count of boundary cycles",
      "n_connected_components": "discrete components",
      "orientable": true,
      "is_closed": "n_boundary_loops == 0"
    },
    "halfedge": {
      "attributes": {
        "description": "Per-halfedge connectivity arrays. Currently constructed internally by geometry-central; planned for exposure via nxr::compute::topology::halfedge(ctx) (see docs/extensions.md §10)."
      },
      "twin": {
        "attributes": {
          "description": "Opposite halfedge index. -1 (or self) on boundary halfedges, depending on convention.",
          "shape": "[H]",
          "dtype": "int32",
          "storage": "row_major",
          "memory_bytes": "4 * H",
          "depends_on": ["core/faces"],
          "implemented_by": {
            "cpp": "nxr::compute::topology::halfedge(ctx).twin (planned; via geometry-central halfedge iteration)"
          },
          "complexity": "O(H)"
        }
      },
      "next": {
        "attributes": {
          "description": "Next halfedge around the face.",
          "shape": "[H]",
          "dtype": "int32",
          "storage": "row_major",
          "memory_bytes": "4 * H",
          "depends_on": ["core/faces"],
          "implemented_by": {
            "cpp": "nxr::compute::topology::halfedge(ctx).next (planned)"
          },
          "complexity": "O(H)"
        }
      },
      "vertex": {
        "attributes": {
          "description": "Tail vertex of each halfedge.",
          "shape": "[H]",
          "dtype": "int32",
          "storage": "row_major",
          "memory_bytes": "4 * H",
          "depends_on": ["core/faces"],
          "implemented_by": {
            "cpp": "nxr::compute::topology::halfedge(ctx).vertex (planned)"
          },
          "complexity": "O(H)"
        }
      },
      "face": {
        "attributes": {
          "description": "Incident face index, or -1 on boundary halfedges.",
          "shape": "[H]",
          "dtype": "int32",
          "storage": "row_major",
          "memory_bytes": "4 * H",
          "depends_on": ["core/faces"],
          "implemented_by": {
            "cpp": "nxr::compute::topology::halfedge(ctx).face (planned)"
          },
          "complexity": "O(H)"
        }
      },
      "edge": {
        "attributes": {
          "description": "Undirected edge index per halfedge (twin pairs share an edge index).",
          "shape": "[H]",
          "dtype": "int32",
          "storage": "row_major",
          "memory_bytes": "4 * H",
          "depends_on": ["core/faces"],
          "implemented_by": {
            "cpp": "nxr::compute::topology::halfedge(ctx).edge (planned)"
          },
          "complexity": "O(H)"
        }
      },
      "is_boundary": {
        "attributes": {
          "description": "1 if the halfedge is on a boundary loop, 0 otherwise.",
          "shape": "[H]",
          "dtype": "uint8",
          "storage": "row_major",
          "memory_bytes": "1 * H",
          "depends_on": ["core/faces"],
          "implemented_by": {
            "cpp": "nxr::compute::topology::halfedge(ctx).is_boundary (planned)"
          },
          "complexity": "O(H)"
        }
      }
    }
  },

  "geometry": {
    "attributes": {
      "description": "Per-element scalars and vectors that depend on the embedding (vertex positions). Distinct from topology, which is connectivity-only.",
      "total_area": "Σ_f areas[f]"
    },
    "face": {
      "attributes": {
        "description": "Per-face quantities computed from vertex positions and face indices."
      },
      "normals": {
        "attributes": {
          "description": "Per-face unit normals (right-hand rule from face winding).",
          "shape": "[F, 3]",
          "dtype": "float64",
          "storage": "row_major",
          "memory_bytes": "8 * F * 3",
          "depends_on": ["core/vertices", "core/faces"],
          "implemented_by": {
            "cpp":        "nxr::compute::computeFaceFrames(ctx).normals",
            "node_addon": "ctx.computeFaceFrames().normals",
            "wasm":       "ctx.computeFaceFrames().normals",
            "mex":        "nxr_compute('computeFaceFrames', V, F).normals"
          },
          "complexity": "O(F)"
        }
      },
      "areas": {
        "attributes": {
          "description": "Triangle areas (½ |edge_a × edge_b|).",
          "shape": "[F]",
          "dtype": "float64",
          "storage": "row_major",
          "memory_bytes": "8 * F",
          "depends_on": ["core/vertices", "core/faces"],
          "formula": "areas[f] = (1/2) |(v1 - v0) × (v2 - v0)|",
          "complexity": "O(F)",
          "units": "world units²"
        }
      },
      "centroids": {
        "attributes": {
          "description": "Triangle centroids (mean of three vertices).",
          "shape": "[F, 3]",
          "dtype": "float64",
          "storage": "row_major",
          "memory_bytes": "8 * F * 3",
          "depends_on": ["core/vertices", "core/faces"],
          "formula": "centroids[f] = (1/3) (v0 + v1 + v2)",
          "complexity": "O(F)",
          "units": "world units"
        }
      },
      "frames": {
        "attributes": {
          "description": "Per-face orthonormal tangent frame {e1, e2}. e1 is the unit edge vector along f.halfedge(); e2 = normal × e1. Convention matches the trivial-connection direction-field code so transported tangent vectors are interpretable in the same coordinate system across faces.",
          "shape": "{e1[F,3], e2[F,3]}",
          "dtype": "float64",
          "storage": "struct",
          "memory_bytes": "8 * F * 6",